{
  "$schema": "./schema/card_skin.schema.json",
  "id": "card_skin",
  "label": "Battle Hand-Card Skin",
  "box": { "w": 3, "h": 4 },
  "types": {
   "sword":  { "icon": "combat_sword_icon",  "color": "wood"   },
   "shield": { "icon": "combat_shield_icon", "color": "wood"   },
   "bow":    { "icon": "combat_bow_icon",    "color": "wood",
               "uses_icons": ["combat_5_arrows_left", "combat_4_arrows_left",
                              "combat_3_arrows_left", "combat_2_arrows_left",
                              "combat_1_arrow_left", "combat_0_arrows_left"],
               "uses_power_icon": "combat_nine_icon" },
   "heal":   { "icon": "combat_ring_icon",     "color": "wood"   },
   "dagger": { "icon": "combat_dagger_icon",   "color": "wood" }
  }
}
